{
  "schemaVersion": 1,
  "id": "com.ambokit.aep.airdraw",
  "name": "AirDraw",
  "description": "Draw on the television with your hands in the air. Hand shapes choose what to do; the body's wrist says where.",
  "renderers": ["android-tv"],
  "requiresCalibration": false,
  "capabilities": {
    "required": ["camera.hand"],
    "optional": ["camera.pose"]
  },
  "aep": { "minimumVersion": "0.9.0" }
}
